Statistieken over interacties voor individuele updates Datum aangemaakt laat zien wanneer de update werd gemaakt. Alle datums en tijden worden weergegeven in UTC.,,,,,,,,,,,,,,,,,
Titel van update,Link naar update,Soort update,Naam van de campagne,Geplaatst door,Aangemaakt,Begindatum van campagne,Einddatum van campagne,Doelgroep,Weergaven,Videoweergaven,Klikken,Doorklikfrequentie (CTR),Interessant,Commentaren,Gedeeld,Gevolgd,Interactiefrequentie
"In Hét Ondernemersbelang staat een interview over de energiedoelen van Gemeente Lingewaard met wethouder duurzaamheid Aart Slob. 

Lees hier het hele interview: https://lnkd.in/dxcDhc3 
",https://www.linkedin.com/feed/update/urn:li:activity:6727978157988700161,Spontaan ,,Saskia van Zanen,10/30/2020,,,Alle volgers,365,,53,0.145205483,13,0,0,,0.180821911
"Gemeente Lingewaard en Provincie Gelderland werken samen met onder meer het Arnhemse bureau IF Technology en TNO om hoge warmte-opslag te onderzoeken.

De boring wordt uitgevoerd door De Ruiter Grondwatertechniek

Kijk mee met de video voor meer informatie! 

#EURegionsWeek #ThinkEastNL #SmartFoodProduction #ClimateNeutralandCircularFoodProduction Think East Netherlands",https://www.linkedin.com/feed/update/urn:li:activity:6727943336121905152,Spontaan ,,Saskia van Zanen,10/30/2020,,,Alle volgers,244,589,15,0.061475411,22,1,5,,0.176229507
"Het einde van het hortensia seizoen nadert... Koop nu de snijhortensia bij de teler of bloemist! 🌸

Bekijk de kleurrijke video van Kwekerij Zeestraten - Freesia en Hortensia.",https://www.linkedin.com/feed/update/urn:li:activity:6727611553027256321,Spontaan ,,Saskia van Zanen,10/29/2020,,,Alle volgers,161,82,0,0,6,0,1,,0.043478262
"Het is vandaag alweer een week geleden dat de European Week of Regions and Cities plaatsvond. 

NEXTgarden heeft hier ook mogen spreken. Verschillende regio's in heel Europa zijn belangrijke drijfveren voor de voedseltransitie en geven vorm aan de toekomst van sterke en gezonde Europese voedselketens en Europese burgers.

Lees er hier alles over!  http://ow.ly/V3W750C2oZq 
#EURegionsweek #ThinkEastNetherlands #SmartFoodProduction",https://www.linkedin.com/feed/update/urn:li:activity:6727142015034777600,Spontaan ,,Saskia van Zanen,10/28/2020,,,Alle volgers,215,,1,0.004651163,7,0,0,,0.037209302
"Wederom een mooie stap in het behalen van onze ambities in de energietransitie.

Programma Aardgasvrije Wijken
Provincie Gelderland
Gemeente Lingewaard
#aardgasvrij #duurzaam #warmtenetwerk 

Meer informatie is ook te vinden op onze website: https://lnkd.in/e94iRwb ",https://www.linkedin.com/feed/update/urn:li:activity:6726503422767484928,Spontaan ,,Saskia van Zanen,10/26/2020,,,Alle volgers,281,,11,0.039145909,6,0,0,,0.060498219
"De nieuwsbrief van Regio Arnhem Nijmegen is online! De regio waar het goed wonen, goed ondernemen, goed recreëren en vooral goed leven is.

Updates over EWRC, Polis 2020, Covid-19 maatregelen en meer...http://ow.ly/2E3q50C0wrf",https://www.linkedin.com/feed/update/urn:li:activity:6725345079868829696,Spontaan ,,Saskia van Zanen,10/23/2020,,,Alle volgers,116,,1,0.00862069,0,0,0,,0.00862069
"NEXTgarden zoekt naar een duurzame energiemix, met als doel: 100% energieneutrale teelt. 

Dat doel wordt bereikt door aan de ene kant energie te besparen en aan de andere kant meer duurzame energie op te wekken.

Je hoort er alles over in de video!
Meer info? https://lnkd.in/dv96XzC",https://www.linkedin.com/feed/update/urn:li:activity:6725037397429518336,Spontaan ,,Saskia van Zanen,10/22/2020,,,Alle volgers,128,66,1,0.0078125,4,0,1,,0.046875
"Speuren naar ideale zandlaag, diep in Betuwse aardbodem, om Zilverkamp op te warmen.

De boorinstallatie heeft een week nodig om bijna een halve kilometer de Lingewaardse grond in te komen. Vermoedelijk is het gebied in en om NEXTgarden het meest geschikt voor warmte-opslag op die diepte.

Lees hier alles over de proefboring: http://ow.ly/mHe350BVVR6

Foto: Paul Rapp",https://www.linkedin.com/feed/update/urn:li:activity:6723880425313312769,Spontaan ,,Saskia van Zanen,10/19/2020,,,Alle volgers,332,,11,0.033132531,11,0,0,,0.066265061
"Het is vandaag de laatste dag waarop je je kunt aanmelden voor de workshop Climate Neutral & Circular Food Production bij de EU Regions Week or European Week of Regions and Cities. NEXTgarden doet hier ook aan mee. 

Kijk op https://lnkd.in/ePECM3v voor meer informatie en meld je vandaag nog aan! 

#EURegionsWeek #ThinkEastNL #SmartFoodProduction #ClimateNeutralandCircularFoodProduction ",https://www.linkedin.com/feed/update/urn:li:activity:6722161423826399232,Spontaan ,,Saskia van Zanen,10/14/2020,,,Alle volgers,153,,4,0.026143791,2,1,0,,0.045751635
"Vandaag is de dag van de duurzaamheid ♻️🌍

NEXTgarden gaat voor een 100% klimaatneutrale teelt in 2030. Samen zijn wij al goed op weg, hoe we dat doen? Kijk snel deze animatie, in enkele minuten weet u bijna alles!

Wat doe jij om duurzamer te leven?",https://www.linkedin.com/feed/update/urn:li:activity:6720226434540953600,Spontaan ,,Saskia van Zanen,10/09/2020,,,Alle volgers,200,77,7,0.035,8,0,2,,0.085000001
"Van 14 tot en met 21 oktober vindt een unieke activiteit plaats in NEXTgarden. Een proefboring van bijna 500 meter diep naar de mogelijkheden van warmteopslag. Het kunnen opslaan van warmte speelt in de energie transitie een cruciale rol.

TNO en IF Technology begeleiden deze boring, in opdracht van Gemeente Lingewaard en met ondersteuning van Provincie Gelderland. Aannemer De Ruiter Grondwatertechniek voert deze boring uit. 

Lees hier meer informatie: http://ow.ly/F94X50BLMye",https://www.linkedin.com/feed/update/urn:li:activity:6719539277052579841,Spontaan ,,Saskia van Zanen,10/07/2020,,,Alle volgers,1510,,110,0.072847679,46,1,1,,0.10463576
"Lokaal voedsel produceren en consumeren heeft veel voordelen. Het draagt bij aan een betere biodiversiteit, een eerlijkere prijs en meer transparantie in de keten. Bovenal is het een duurzaam proces, zowel op het gebied van transportuitstoot als in de productiewijze 🌱

📸 De teelt van kurkuma op de NEXTgarden Ingredient Farm. Lees er hier meer over: http://ow.ly/pPAP50BKzhq",https://www.linkedin.com/feed/update/urn:li:activity:6719184478205431808,Spontaan ,,Saskia van Zanen,10/06/2020,,,Alle volgers,248,,9,0.036290321,8,0,1,,0.072580643
"NEXTgarden houdt zich onder andere bezig met het opwekken van duurzame energie. 

Sinds 2018 heeft NEXTgarden een drijvend zonnepark op een gietwaterbassin. Deze zonnepanelen voorzien ruim 600 huishoudens van energie. 

In 2019 is Zonnepark Lingewal aangelegd in NEXTgarden. Het zonnepark omvat bijna 40.000 panelen.

Lees hier meer over de duurzame energiemix van NEXTgarden: 
http://ow.ly/UGyw50BJQN5",https://www.linkedin.com/feed/update/urn:li:activity:6718912727919689728,Spontaan ,,Saskia van Zanen,10/05/2020,,,Alle volgers,231,,5,0.021645023,5,0,2,,0.051948052
"NEXTgarden werkt aan een energieneutraal tuinbouwgebied. 
Wij zetten in op 4 domeinen: 
✔️ Energiebesparing
✔️ Opwekking van duurzame energie
✔️ Opslag van energie 
✔️ Energie infrastructuur 

Volgende week staat in het teken van duurzaamheid ✅
Lees er alvast alles over op onze website: http://ow.ly/azJa50BHv5F",https://www.linkedin.com/feed/update/urn:li:activity:6718082255589281792,Spontaan ,,Saskia van Zanen,10/03/2020,,,Alle volgers,215,,8,0.037209302,4,0,1,,0.060465116
"In glastuinbouwgebied NEXTgarden in Gemeente Lingewaard zijn veel mooie tuinbouwbedrijven gevestigd. Samen willen wij ervoor zorgen dat de tuinbouw binnen NEXTgarden is voorbereid op de toekomst.

Neem een kijkje in de nieuwe kas van Karma Plants 🌱
Meer informatie over NEXTgarden vind je op de website: http://ow.ly/L2dk50BFaXq",https://www.linkedin.com/feed/update/urn:li:activity:6717002672219676672,Spontaan ,,Saskia van Zanen,09/30/2020,,,Alle volgers,190,105,5,0.02631579,10,0,1,,0.08421053
"NEXTgarden is trots op de ondernemers die zich vestigen is het glastuinbouwgebied. 

Neem een kijkje in de kas van Hofstede Hovaria! 🍃

Wil je meer weten over tuinbouwgebied NEXTgarden? Alle informatie staat op onze website: www.nextgarden.nl",https://www.linkedin.com/feed/update/urn:li:activity:6707634500735668225,Spontaan ,,Saskia van Zanen,09/04/2020,,,Alle volgers,190,55,3,0.015789473,5,0,0,,0.042105265
"Volg jij ons instagram kanaal al? 

Voor een kleurrijke tijdlijn vol met weetjes over NEXTgarden kun je ons ook volgen op instagram: http://ow.ly/HV7H50B11Jz",https://www.linkedin.com/feed/update/urn:li:activity:6704025304408715264,Spontaan ,,Saskia van Zanen,08/25/2020,,,Alle volgers,186,,7,0.03763441,4,0,1,,0.064516127
"Jaarlijks wordt in de regio Arnhem-Nijmegen een seminar georganiseerd over actuele zaken die in de tuinbouwsector spelen. Dit jaar  is er gekozen voor een webinar. 

Neem deel aan de interactieve webinar op 3 september 2020 van 15.00 uur tot 16.45 uur ➡️ http://ow.ly/ZSo450B5tTV

#webinar #tuinbouw #tuinbouwsector #NEXTgarden",https://www.linkedin.com/feed/update/urn:li:activity:6702575148182073344,Spontaan ,,Saskia van Zanen,08/21/2020,,,Alle volgers,266,,10,0.037593983,5,0,0,,0.056390978
"NEXTgarden ligt in de regio met de meeste 'groene' kennis ter wereld. Samen willen wij ervoor zorgen dat de tuinbouw binnen NEXTgarden is voorbereid op de toekomst. 

Lees  meer over onze projecten! 
http://ow.ly/QhTT50B2bYX

Op de foto: NEXTgarden Ingredient Farm met LED verlichting.",https://www.linkedin.com/feed/update/urn:li:activity:6701427671261294592,Spontaan ,,Saskia van Zanen,08/18/2020,,,Alle volgers,484,,13,0.026859503,13,0,0,,0.053719006
"Kijk je mee met een video van Pioenrozenkwekerij Braam - van de Pas? 

Op deze zonnige dag kijken we terug naar het pioenrozenseizoen 🌷🌹🌸

Veel kijkplezier!",https://www.linkedin.com/feed/update/urn:li:activity:6696720195324530688,Spontaan ,,Saskia van Zanen,08/05/2020,,,Alle volgers,256,97,4,0.015625,7,0,1,,0.046875
"Op deze zonnige dag nemen we een kijkje in de potplantenkwekerij Ewijk in tuinbouwgebied NEXTgarden. 

Kijk je mee?

Meer weten over NEXTgarden, bekijk onze website!  https://www.nextgarden.nl",https://www.linkedin.com/feed/update/urn:li:activity:6694225141427122176,Spontaan ,,Saskia van Zanen,07/29/2020,,,Alle volgers,240,170,3,0.0125,8,0,1,,0.050000001
"In glastuinbouwgebied NEXTgarden in Gemeente Lingewaard zijn veel mooie tuinbouwbedrijven gevestigd. 

Neem een kijkje in de kas van Zandvoort Flowers!",https://www.linkedin.com/feed/update/urn:li:activity:6690918463071891456,Spontaan ,,Saskia van Zanen,07/20/2020,,,Alle volgers,590,148,13,0.022033898,12,0,0,,0.042372882
"Vanmorgen heeft NPO Radio 1 een interview gehouden met Jan Taks over de teelt van #kurkuma en zwarte peper. 

In #tuinbouwgebied NEXTgarden in Gemeente Lingewaard wordt onderzoek gedaan naar de teelt van exotische #specerijen. 

Luister mee! 
Meer info? http://ow.ly/gpnj50AyQxZ",https://www.linkedin.com/feed/update/urn:li:activity:6689151716794884096,Spontaan ,,Saskia van Zanen,07/15/2020,,,Alle volgers,1054,1056,25,0.023719165,21,1,5,,0.049335863
"Exotische specerijen, gemaakt in de Betuwe: ‘Kurkuma telen blijkt eigenlijk helemaal niet zo lastig’

Lees het hele artikel uit De Gelderlander en bekijk de video! 
➡️ http://ow.ly/wO7k50AxEnh
Erik Janssen 
HAS Hogeschool 
Sander Govaert

#tuinbouw #ontwikkeling #specerijen #kurkuma",https://www.linkedin.com/feed/update/urn:li:activity:6688744107839373312,Spontaan ,,Saskia van Zanen,07/14/2020,,,Alle volgers,1001,460,21,0.020979021,23,1,5,,0.049950048
"NEXTgarden herbergt grote spelers die in Europa en wereldwijd actief zijn.

Een aantal ondernemers kiest er voor om een deel van hun productie lokaal, regionaal en over de grens in Duitsland te vermarkten en is daar succesvol in.",https://www.linkedin.com/feed/update/urn:li:activity:6684773855992524800,Spontaan ,,Saskia van Zanen,07/03/2020,,,Alle volgers,230,,3,0.013043478,1,0,0,,0.017391304
"De meeste 'groene' kennis ter wereld vindt u in onze regio. U kunt participeren in een van de netwerkorganisaties die kennis, vakmanschap en business met elkaar verbinden.",https://www.linkedin.com/feed/update/urn:li:activity:6684048858877620224,Spontaan ,,Saskia van Zanen,07/01/2020,,,Alle volgers,156,,2,0.012820513,3,0,0,,0.032051284
"De nieuwsbrief van de Glastuinbouwpact Arnhem-Nijmegen staat online! 

Met onder andere: 
✅ 25 juni - Live debat over agrarische seizoenarbeiders
✅ Oosterhoutse keker zet Voedselbank in de bloemen
✅ 'Focus op herstel' voor de tuinbouw

En nog veel meer! Lees je mee? http://ow.ly/GcVJ50AgiwY",https://www.linkedin.com/feed/update/urn:li:activity:6681541601157816321,Spontaan ,,Saskia van Zanen,06/24/2020,,,Alle volgers,154,,4,0.025974026,1,0,0,,0.032467533
"Dit weekend is het alweer #vaderdag! Ook vaders kunnen heel blij worden van een bloemetje 💐

Koop jij #lokaal een mooie bos bloemen of een plantje om jouw vader extra in het zonnetje te zetten dit #weekend? ☀️",https://www.linkedin.com/feed/update/urn:li:activity:6679759858641768448,Spontaan ,,Saskia van Zanen,06/19/2020,,,Alle volgers,125,,1,0.008,5,0,0,,0.048
"In de Regio Arnhem Nijmegen werken wij samen met 15 gemeenten, de provincie en 3 waterschappen aan regionale plannen voor het opwekken van duurzame energie. 

Ook NEXTgarden doet mee. Lees hier meer informatie! http://ow.ly/Rwhy50zZZyo",https://www.linkedin.com/feed/update/urn:li:activity:6674693806379565056,Spontaan ,,Saskia van Zanen,06/05/2020,,,Alle volgers,203,,5,0.024630541,3,0,0,,0.039408866
"Het project ‘Experience The Horticulture NEXTgarden’ onderzoekt of een belevingscentrum kan bijdragen aan de kennis en betrokkenheid van burgers en bezoekers bij de glastuinbouwsector in de regio. 

Lees er hier meer over: http://ow.ly/Eovk50zThDf",https://www.linkedin.com/feed/update/urn:li:activity:6672074078406365184,Spontaan ,,Saskia van Zanen,05/29/2020,,,Alle volgers,170,,6,0.035294119,6,0,2,,0.082352944
"NEXTgarden is hét ontwikkelingsgebied voor tuinbouw. 

Wil jij hier meer over weten? Bezoek onze website! www.nextgarden.nl",https://www.linkedin.com/feed/update/urn:li:activity:6671409818151989248,Spontaan ,,Saskia van Zanen,05/27/2020,,,Alle volgers,229,,8,0.034934498,5,0,1,,0.06113537
"De nieuwsbrief van NEXTgarden staat online! 

In de nieuwsbrief wordt een update gegeven over het project Experience the Horticulture NEXTgarden. 

Lees er snel meer over: http://ow.ly/4wBW50zLDkC 

Schrijf je hier in voor de nieuwsbrief! http://ow.ly/ypwI50zLDlQ",https://www.linkedin.com/feed/update/urn:li:activity:6668895597573103616,Spontaan ,,Saskia van Zanen,05/20/2020,,,Alle volgers,244,,25,0.102459013,4,1,1,,0.127049178
"Gelderland biedt hulp om sterk uit de #crisis te komen! 

Provincie Gelderland wil bedrijven ondersteunen en stelt voor bedrijven in de #tuinbouwsector geld beschikbaar om met een adviseur/coach te kunnen sparren over hun situatie en om een plan van aanpak op te stellen. 

Lees er hier alles over! http://ow.ly/srkY50zIUbF",https://www.linkedin.com/feed/update/urn:li:activity:6668148341983064065,Spontaan ,,Saskia van Zanen,05/18/2020,,,Alle volgers,230,,7,0.030434782,5,0,1,,0.05652174
"Door het sluiten van de horeca, koken mensen meer thuis. Hierdoor groeit de vraag naar kruiden en specerijen terwijl lockdowns in herkomstlanden de aanvoer bemoeilijken. Koninklijke Euroma BV en Verstegen Spices & Sauces B.V. reageren.

Lees er alles over in dit artikel van VMT: http://ow.ly/64Uo50zBwad

#Ingredientfarm #localforlocal #stikstofreductie #duurzaamtelen",https://www.linkedin.com/feed/update/urn:li:activity:6665551190341877760,Spontaan ,,Saskia van Zanen,05/11/2020,,,Alle volgers,290,,11,0.037931036,4,0,1,,0.055172414
"Fijne moederdag allemaal! 🌹

Nog geen cadeau? Wees loyaal en koop lokaal een bloemetje of plantje! 💐",https://www.linkedin.com/feed/update/urn:li:activity:6665159701237497856,Spontaan ,,Saskia van Zanen,05/10/2020,,,Alle volgers,142,,2,0.014084507,2,0,0,,0.028169014
"Moederdag komt eraan! 🌹

Tijd om een mooi cadeau voor haar te scoren! Tover een glimlach op haar gezicht met een prachtig bloemetje of plantje! 

NEXTgarden is trots op al haar ondernemers, wees loyaal en koop lokaal iets moois! 🌸
De beelden zijn gemaakt bij Bejafleur B.V.",https://www.linkedin.com/feed/update/urn:li:activity:6664086397454024704,Spontaan ,,Saskia van Zanen,05/07/2020,,,Alle volgers,362,4,13,0.035911601,10,0,0,,0.063535914
"Nieuwsbrief Greenport Gelderland weer online!

Lees hem hier! http://ow.ly/oo4X50zx5Ua",https://www.linkedin.com/feed/update/urn:li:activity:6663391860029034496,Spontaan ,,Saskia van Zanen,05/05/2020,,,Alle volgers,108,,0,0,0,0,0,,0
"Door de huidige coronacrisis staan bedrijven in de sierteelt en voedingstuinbouw en -glasbouw voor een uitdaging die op termijn niet alleen maar negatief hoeft uit te pakken. 

Lees hier het hele artikel over Greenport Arnhem-Nijmegen van The Economic Board: https://lnkd.in/gWamse2",https://www.linkedin.com/feed/update/urn:li:activity:6663014380134899712,Spontaan ,,Saskia van Zanen,05/04/2020,,,Alle volgers,334,,11,0.032934133,6,0,1,,0.053892214
